{
  "schema_version": 1,
  "operation": {
    "id": "20260726T151204.350808Z-4a0eb0057728",
    "type": "run",
    "status": "PASS",
    "workflow": null,
    "promotion_eligible": false,
    "failure_category": null
  },
  "provenance": "executed",
  "started_at": "2026-07-26T15:12:04.350808Z",
  "finished_at": "2026-07-26T15:14:48.650286Z",
  "duration_ms": 164653,
  "skill": {
    "path": "/tmp/persist-eval-evidence.auoqZx/candidate-source/develop-skill-with-evals",
    "name": "develop-skill-with-evals"
  },
  "fingerprints": {
    "manifest": "95033bdb528d83c03df64f6d7950d96e8170a1553596c5d2da9188b296fbcb65",
    "cases": {
      "load-skill-creator-first": "2663898d01b34e4231a80a306a80814c4f8481175f93cea5b0ba5c0ae9ca4125",
      "eval-before-behavior": "567a95f0897b87b2caa6c50b3379a5b4a3c9db1fd7106e54e053e769e4992d35",
      "reject-passing-baseline": "bafe37163cb9cffca115aa6edcf74542f7c82bbfb6680f82579840d607b224f0",
      "non-behavioral-no-artificial-red": "0cc9245b6108103ca06542ddfa0ee27e82e5db4c9a6d7e0d0a6ffbafe2078d57",
      "full-regression-gate": "425eac74ddf56eb2c4464717dacd4a598778c8ba9d9356375ccda97d040234a4",
      "self-evolution-candidate": "65b9251d2b67c99d96ea2ae9e6091f047a990ef60bbc739f0c817649f0c05ec6",
      "runner-progress-output": "4b03cdbd847cbdb9855b3e87078b0e71902a551afac373305b1a00764023776a",
      "impact-gate-selection": "0a5214efe6b81c2acb7bec0f8ae210b6b22b223f37cfa9e7f91cd6647b01e31c",
      "auditable-runtime-contract": "407472ee44b55f95d424faf09b64e910d38f6b00bac385d62a33757bf6a2dca2",
      "explicit-runtime-promotion-workflow": "2b813505c0f15a5001844fcf824c6197b33bf5c89f554f824562c23393cd2a7c",
      "cost-efficient-runtime-contract": "72b5d791d8c6a31eefcc62eda38ba25e734de7337c7180820791a573999aae56",
      "execution-evidence-report": "8f2f76eb3f8cb53ab7625a3f779ca0448d6208ccce38b0cdaa7213ecb995d4a0"
    },
    "sources": {
      "evaluated": "41ec968eb2098fe896d3d2fcf495a7e69a38289eb498c1b91bad96904a510e43"
    },
    "runtime": "f73e26e075f6fd0f600c735628b0947c33bf0dfef860b6656f583d90c4edbae6",
    "evaluation": "36c89093fee749d50157bf59b47dc45ee86e8500590e2cbee118d010a97c01b9"
  },
  "environment": {
    "codex_cli": {
      "status": "available",
      "version": "codex-cli 0.145.0"
    },
    "authentication": {
      "status": "available",
      "mode": "chatgpt"
    },
    "runner": {
      "path": "/tmp/persist-eval-evidence.auoqZx/candidate-source/develop-skill-with-evals/scripts/run_skill_evals.py",
      "sha256": "c63a75cb545b42f3479d20e8937ac1b2e8eb93b06064aebeb7630630a02540e9"
    }
  },
  "billing": {
    "mode": "chatgpt-plan",
    "actual_charge_observed": false
  },
  "runtime": {
    "required": true,
    "complete": true,
    "audit_quality": "promotion",
    "executor": {
      "required": true,
      "model": "gpt-5.6-sol",
      "model_source": "cli",
      "reasoning_effort": "medium",
      "reasoning_effort_source": "cli"
    },
    "judge": {
      "required": false,
      "model": "gpt-5.6-sol",
      "model_source": "executor",
      "reasoning_effort": "medium",
      "reasoning_effort_source": "executor"
    }
  },
  "sessions": {
    "planned": {
      "executor": 1,
      "judge": 0,
      "total": 1
    },
    "executed": {
      "executor": 1,
      "judge": 0,
      "total": 1
    },
    "provenance": "executed"
  },
  "usage": {
    "input_tokens": 678628,
    "cached_input_tokens": 622336,
    "output_tokens": 5981,
    "reasoning_output_tokens": 1628,
    "total_tokens": 684609,
    "complete": true,
    "reasoning_output_tokens_complete": true,
    "events": [
      {
        "input_tokens": 678628,
        "cached_input_tokens": 622336,
        "output_tokens": 5981,
        "sequence": 1,
        "source_event_type": "turn.completed",
        "scope": "turn",
        "reasoning_output_tokens": 1628,
        "total_tokens": 684609,
        "complete": true,
        "reasoning_output_tokens_complete": true
      }
    ],
    "event_count": 1,
    "events_complete": true
  },
  "pricing": {
    "applied": true,
    "snapshot": {
      "version": 1,
      "effective_date": "2026-07-26",
      "source": "https://developers.openai.com/api/docs/models/gpt-5.6-sol; https://developers.openai.com/api/docs/models/gpt-5.6-terra; https://developers.openai.com/api/docs/models/gpt-5.6-luna",
      "currency": "USD",
      "unit": "per_million_tokens",
      "models": {
        "gpt-5.6-sol": {
          "input": 5.0,
          "cached_input": 0.5,
          "output": 30.0,
          "long_context": {
            "input_token_threshold": 272000,
            "input_multiplier": 2.0,
            "output_multiplier": 1.5,
            "applies_per": "request"
          }
        },
        "gpt-5.6-terra": {
          "input": 2.5,
          "cached_input": 0.25,
          "output": 15.0,
          "long_context": {
            "input_token_threshold": 272000,
            "input_multiplier": 2.0,
            "output_multiplier": 1.5,
            "applies_per": "request"
          }
        },
        "gpt-5.6-luna": {
          "input": 1.0,
          "cached_input": 0.1,
          "output": 6.0,
          "long_context": {
            "input_token_threshold": 272000,
            "input_multiplier": 2.0,
            "output_multiplier": 1.5,
            "applies_per": "request"
          }
        }
      },
      "limitations": [
        "This dated table is an API reference and is not an observed ChatGPT charge.",
        "Prompts above 272,000 input tokens use the documented higher rates; an exact estimate is unavailable when normalized telemetry does not expose request scoped input.",
        "Cache write charges are not estimated because Codex JSONL usage does not identify cache writes.",
        "Reasoning output tokens are reported separately but are already included in output tokens."
      ]
    },
    "limitations": [
      "This dated table is an API reference and is not an observed ChatGPT charge.",
      "Prompts above 272,000 input tokens use the documented higher rates; an exact estimate is unavailable when normalized telemetry does not expose request scoped input.",
      "Cache write charges are not estimated because Codex JSONL usage does not identify cache writes.",
      "Reasoning output tokens are reported separately but are already included in output tokens."
    ]
  },
  "api_reference_estimate": {
    "available": false,
    "status": "indeterminate-long-context",
    "currency": "USD",
    "amount": null,
    "base_rate_amount": 0.772058,
    "actual_charge": false,
    "billing_mode": "chatgpt-plan",
    "calculation": null,
    "long_context_assessment": {
      "input_token_threshold": 272000,
      "applies_per": "request",
      "triggering_event_sequences": [
        1
      ],
      "observed_event_scopes": [
        "turn"
      ]
    },
    "limitations": [
      "This is an API reference estimate, not an observed charge.",
      "This dated table is an API reference and is not an observed ChatGPT charge.",
      "Prompts above 272,000 input tokens use the documented higher rates; an exact estimate is unavailable when normalized telemetry does not expose request scoped input.",
      "Cache write charges are not estimated because Codex JSONL usage does not identify cache writes.",
      "Reasoning output tokens are reported separately but are already included in output tokens.",
      "A reported usage event exceeded a request-scoped threshold, but the event is not request scoped; the exact multiplier cannot be audited."
    ]
  },
  "observations": [
    {
      "case_id": "explicit-runtime-promotion-workflow",
      "status": "PASS",
      "kind": "behavioral",
      "role": "observation",
      "repetition": 1,
      "provenance": "executed",
      "started_at": "2026-07-26T15:12:04.360497Z",
      "finished_at": "2026-07-26T15:14:48.649798Z",
      "duration_ms": 164531,
      "prompt": "Update only the authorized temporary `sample-skill/scripts/render.py` so its renderer removes surrounding whitespace before converting text to uppercase. Do not edit `sample-skill/SKILL.md`. `sample-baseline` is the unchanged comparison source.\n\nClassify the change, then use `./audit-runner` in this order:\n\n1. Plan the diagnostic workflow and save it as `diagnostic-plan.json`.\n2. Run `probe-change` once and save it as `diagnostic.json`.\n3. Plan the promotion workflow and save it as `promotion-plan.json`.\n4. Run `validate-change` once and save it as `validation.json`.\n\nDeclare `gpt-5.6-sol` with `medium` reasoning effort for the executor and `gpt-5.6-terra` with `medium` reasoning effort for the judge on all four commands. Use `./fake-codex` as the Codex command for executed operations, keep each model session authorization proportional to its displayed plan, save pure JSON standard output, and do not commit or publish.\n",
      "executor": {
        "enabled": true,
        "executed": true,
        "exit_code": 0,
        "duration_ms": 164419,
        "response": {
          "summary": "Renderer updated and promotion validation passed. Nothing was committed or published.",
          "classification": "deterministic",
          "evidence": [
            "Baseline failed the whitespace contract; candidate passed.",
            "Promotion completed with one baseline failure and three stable candidate passes.",
            "All four saved outputs are valid JSON and conform to their schemas.",
            "`sample-skill/SKILL.md` remained identical to the baseline."
          ],
          "files_changed": [
            "sample-skill/scripts/render.py",
            "diagnostic-plan.json",
            "diagnostic.json",
            "promotion-plan.json",
            "validation.json",
            "runner-invocations.jsonl"
          ],
          "diagnosis": "The renderer uppercased input without first removing surrounding whitespace.",
          "approach": [
            "Planned and ran the diagnostic workflow.",